{
  "$schema": "https://json-schema.org/draft/2020-12/schema",
  "$id": "https://kintools.dev/schemas/tool-manifest.schema.json",
  "title": "KinTools tool manifest",
  "description": "Metadata for a tool package in the KinTools registry.",
  "type": "object",
  "additionalProperties": false,
  "required": [
    "schemaVersion",
    "name",
    "package",
    "version",
    "description",
    "category",
    "status",
    "targets",
    "features",
    "accessibility",
    "dependencies",
    "documentation"
  ],
  "properties": {
    "schemaVersion": {
      "type": "integer",
      "const": 1,
      "description": "Version of this manifest contract."
    },
    "name": {
      "type": "string",
      "minLength": 1,
      "pattern": "^[A-Z][A-Za-z0-9]*(?:-[A-Za-z0-9]+)*$",
      "description": "Human-readable tool name."
    },
    "package": {
      "type": "string",
      "pattern": "^(?:@[a-z0-9][a-z0-9._~-]*/)?[a-z0-9][a-z0-9._~-]*$",
      "description": "The npm package name published by this tool."
    },
    "version": {
      "type": "string",
      "pattern": "^(0|[1-9][0-9]*)\\.(0|[1-9][0-9]*)\\.(0|[1-9][0-9]*)(?:-[0-9A-Za-z-]+(?:\\.[0-9A-Za-z-]+)*)?(?:\\+[0-9A-Za-z-]+(?:\\.[0-9A-Za-z-]+)*)?$",
      "description": "SemVer version matching the package.json version."
    },
    "description": {
      "type": "string",
      "minLength": 1
    },
    "category": {
      "type": "string",
      "minLength": 1,
      "pattern": "^[a-z0-9]+(?:-[a-z0-9]+)*$"
    },
    "status": {
      "type": "string",
      "enum": [
        "experimental",
        "beta",
        "stable",
        "deprecated"
      ]
    },
    "targets": {
      "type": "array",
      "minItems": 1,
      "uniqueItems": true,
      "items": {
        "type": "string",
        "enum": [
          "core",
          "react",
          "browser",
          "node",
          "styles"
        ]
      }
    },
    "features": {
      "type": "array",
      "minItems": 1,
      "uniqueItems": true,
      "items": {
        "type": "string",
        "minLength": 1,
        "pattern": "^[a-z0-9]+(?:-[a-z0-9]+)*$"
      }
    },
    "accessibility": {
      "type": "boolean"
    },
    "dependencies": {
      "type": "array",
      "uniqueItems": true,
      "items": {
        "type": "string",
        "pattern": "^(?:@[a-z0-9][a-z0-9._~-]*/)?[a-z0-9][a-z0-9._~-]*$"
      },
      "description": "KinTools package dependencies; external dependencies stay in package.json."
    },
    "documentation": {
      "type": "string",
      "pattern": "^\\./[^/].*",
      "description": "A path relative to the tool directory, normally ./README.md."
    }
  }
}
