{
  "schemaVersion": 1,
  "name": "SavedViews",
  "package": "@jankincheloe/saved-views",
  "version": "0.1.0",
  "description": "Named, versioned view presets with replaceable persistence.",
  "category": "state",
  "status": "experimental",
  "targets": [
    "core",
    "react"
  ],
  "features": [
    "view-presets",
    "persistence",
    "validation"
  ],
  "accessibility": false,
  "dependencies": [],
  "documentation": "./README.md"
}
